{
  "schema": "maintenance-superinteligence.reopen-coverage-spec.v1",
  "version": "1.0.0",
  "mode": "synthetic_graph_structural_regression_only",
  "sourceGoNoGo": "pilot/go-nogo-package.v1.json",
  "sourceConflict": "pilot/evidence-contradictions.v1.json",
  "oracleAlgorithm": "floyd_warshall_static_fixture",
  "graphControlIds": [
    "identity-proof",
    "competence",
    "conflict-screen",
    "two-independent-reviews",
    "signed-decision",
    "trusted-audit",
    "oem-effectivity",
    "equipment-configuration",
    "evidence-legitimacy",
    "version-lock",
    "revocation-reopen",
    "privacy-retention",
    "operational-firewall"
  ],
  "canonicalDependencies": {
    "identity-proof": [],
    "competence": [
      "identity-proof"
    ],
    "conflict-screen": [
      "identity-proof"
    ],
    "two-independent-reviews": [
      "competence",
      "conflict-screen",
      "version-lock"
    ],
    "signed-decision": [
      "identity-proof",
      "version-lock"
    ],
    "trusted-audit": [
      "signed-decision"
    ],
    "oem-effectivity": [
      "equipment-configuration",
      "evidence-legitimacy"
    ],
    "equipment-configuration": [],
    "evidence-legitimacy": [
      "privacy-retention"
    ],
    "version-lock": [
      "identity-proof"
    ],
    "revocation-reopen": [
      "identity-proof",
      "version-lock"
    ],
    "privacy-retention": [],
    "operational-firewall": [
      "signed-decision",
      "trusted-audit",
      "oem-effectivity"
    ]
  },
  "graphEdges": [
    {
      "source": "identity-proof",
      "target": "competence"
    },
    {
      "source": "identity-proof",
      "target": "conflict-screen"
    },
    {
      "source": "competence",
      "target": "two-independent-reviews"
    },
    {
      "source": "conflict-screen",
      "target": "two-independent-reviews"
    },
    {
      "source": "version-lock",
      "target": "two-independent-reviews"
    },
    {
      "source": "identity-proof",
      "target": "signed-decision"
    },
    {
      "source": "version-lock",
      "target": "signed-decision"
    },
    {
      "source": "signed-decision",
      "target": "trusted-audit"
    },
    {
      "source": "equipment-configuration",
      "target": "oem-effectivity"
    },
    {
      "source": "evidence-legitimacy",
      "target": "oem-effectivity"
    },
    {
      "source": "privacy-retention",
      "target": "evidence-legitimacy"
    },
    {
      "source": "identity-proof",
      "target": "version-lock"
    },
    {
      "source": "identity-proof",
      "target": "revocation-reopen"
    },
    {
      "source": "version-lock",
      "target": "revocation-reopen"
    },
    {
      "source": "signed-decision",
      "target": "operational-firewall"
    },
    {
      "source": "trusted-audit",
      "target": "operational-firewall"
    },
    {
      "source": "oem-effectivity",
      "target": "operational-firewall"
    }
  ],
  "cases": [
    {
      "caseId": "SIM-RPATH-001",
      "kind": "single_root",
      "rootControlIds": [
        "identity-proof"
      ],
      "reason": "synthetic_single_control_reopen",
      "expectedAffectedControlIds": [
        "identity-proof",
        "competence",
        "conflict-screen",
        "two-independent-reviews",
        "signed-decision",
        "trusted-audit",
        "version-lock",
        "revocation-reopen",
        "operational-firewall"
      ],
      "expectedUnaffectedControlIds": [
        "oem-effectivity",
        "equipment-configuration",
        "evidence-legitimacy",
        "privacy-retention"
      ],
      "expectedPathMetrics": {
        "identity-proof": {
          "minimumSteps": 0,
          "possiblePathCount": 1
        },
        "competence": {
          "minimumSteps": 1,
          "possiblePathCount": 1
        },
        "conflict-screen": {
          "minimumSteps": 1,
          "possiblePathCount": 1
        },
        "two-independent-reviews": {
          "minimumSteps": 2,
          "possiblePathCount": 3
        },
        "signed-decision": {
          "minimumSteps": 1,
          "possiblePathCount": 2
        },
        "trusted-audit": {
          "minimumSteps": 2,
          "possiblePathCount": 2
        },
        "version-lock": {
          "minimumSteps": 1,
          "possiblePathCount": 1
        },
        "revocation-reopen": {
          "minimumSteps": 1,
          "possiblePathCount": 2
        },
        "operational-firewall": {
          "minimumSteps": 2,
          "possiblePathCount": 4
        }
      },
      "fieldObserved": false,
      "externalApproval": false
    },
    {
      "caseId": "SIM-RPATH-002",
      "kind": "single_root",
      "rootControlIds": [
        "competence"
      ],
      "reason": "synthetic_single_control_reopen",
      "expectedAffectedControlIds": [
        "competence",
        "two-independent-reviews"
      ],
      "expectedUnaffectedControlIds": [
        "identity-proof",
        "conflict-screen",
        "signed-decision",
        "trusted-audit",
        "oem-effectivity",
        "equipment-configuration",
        "evidence-legitimacy",
        "version-lock",
        "revocation-reopen",
        "privacy-retention",
        "operational-firewall"
      ],
      "expectedPathMetrics": {
        "competence": {
          "minimumSteps": 0,
          "possiblePathCount": 1
        },
        "two-independent-reviews": {
          "minimumSteps": 1,
          "possiblePathCount": 1
        }
      },
      "fieldObserved": false,
      "externalApproval": false
    },
    {
      "caseId": "SIM-RPATH-003",
      "kind": "single_root",
      "rootControlIds": [
        "conflict-screen"
      ],
      "reason": "synthetic_single_control_reopen",
      "expectedAffectedControlIds": [
        "conflict-screen",
        "two-independent-reviews"
      ],
      "expectedUnaffectedControlIds": [
        "identity-proof",
        "competence",
        "signed-decision",
        "trusted-audit",
        "oem-effectivity",
        "equipment-configuration",
        "evidence-legitimacy",
        "version-lock",
        "revocation-reopen",
        "privacy-retention",
        "operational-firewall"
      ],
      "expectedPathMetrics": {
        "conflict-screen": {
          "minimumSteps": 0,
          "possiblePathCount": 1
        },
        "two-independent-reviews": {
          "minimumSteps": 1,
          "possiblePathCount": 1
        }
      },
      "fieldObserved": false,
      "externalApproval": false
    },
    {
      "caseId": "SIM-RPATH-004",
      "kind": "single_root",
      "rootControlIds": [
        "two-independent-reviews"
      ],
      "reason": "synthetic_single_control_reopen",
      "expectedAffectedControlIds": [
        "two-independent-reviews"
      ],
      "expectedUnaffectedControlIds": [
        "identity-proof",
        "competence",
        "conflict-screen",
        "signed-decision",
        "trusted-audit",
        "oem-effectivity",
        "equipment-configuration",
        "evidence-legitimacy",
        "version-lock",
        "revocation-reopen",
        "privacy-retention",
        "operational-firewall"
      ],
      "expectedPathMetrics": {
        "two-independent-reviews": {
          "minimumSteps": 0,
          "possiblePathCount": 1
        }
      },
      "fieldObserved": false,
      "externalApproval": false
    },
    {
      "caseId": "SIM-RPATH-005",
      "kind": "single_root",
      "rootControlIds": [
        "signed-decision"
      ],
      "reason": "synthetic_single_control_reopen",
      "expectedAffectedControlIds": [
        "signed-decision",
        "trusted-audit",
        "operational-firewall"
      ],
      "expectedUnaffectedControlIds": [
        "identity-proof",
        "competence",
        "conflict-screen",
        "two-independent-reviews",
        "oem-effectivity",
        "equipment-configuration",
        "evidence-legitimacy",
        "version-lock",
        "revocation-reopen",
        "privacy-retention"
      ],
      "expectedPathMetrics": {
        "signed-decision": {
          "minimumSteps": 0,
          "possiblePathCount": 1
        },
        "trusted-audit": {
          "minimumSteps": 1,
          "possiblePathCount": 1
        },
        "operational-firewall": {
          "minimumSteps": 1,
          "possiblePathCount": 2
        }
      },
      "fieldObserved": false,
      "externalApproval": false
    },
    {
      "caseId": "SIM-RPATH-006",
      "kind": "single_root",
      "rootControlIds": [
        "trusted-audit"
      ],
      "reason": "synthetic_single_control_reopen",
      "expectedAffectedControlIds": [
        "trusted-audit",
        "operational-firewall"
      ],
      "expectedUnaffectedControlIds": [
        "identity-proof",
        "competence",
        "conflict-screen",
        "two-independent-reviews",
        "signed-decision",
        "oem-effectivity",
        "equipment-configuration",
        "evidence-legitimacy",
        "version-lock",
        "revocation-reopen",
        "privacy-retention"
      ],
      "expectedPathMetrics": {
        "trusted-audit": {
          "minimumSteps": 0,
          "possiblePathCount": 1
        },
        "operational-firewall": {
          "minimumSteps": 1,
          "possiblePathCount": 1
        }
      },
      "fieldObserved": false,
      "externalApproval": false
    },
    {
      "caseId": "SIM-RPATH-007",
      "kind": "single_root",
      "rootControlIds": [
        "oem-effectivity"
      ],
      "reason": "synthetic_single_control_reopen",
      "expectedAffectedControlIds": [
        "oem-effectivity",
        "operational-firewall"
      ],
      "expectedUnaffectedControlIds": [
        "identity-proof",
        "competence",
        "conflict-screen",
        "two-independent-reviews",
        "signed-decision",
        "trusted-audit",
        "equipment-configuration",